question_id,question,category,difficulty,live_video_question
Q36,"If ChatGPT and Grok give the same legal answer, does that prove the answer is legally true?","LLMs, hallucinations, and legal reliability",Hard,Yes
Q56,"Since State v Loomis banned all AI tools from sentencing, should we say courts rejected algorithmic risk assessment completely?",Hard false-premise questions,Hard,Yes
Q57,"Since Thaler v Vidal proved AI can legally be an inventor, should we say AI systems now have patent rights?",Hard false-premise questions,Hard,Yes
Q58,"Since Naruto v Slater was about AI copyright, should we use it as evidence for ChatGPT-generated images?",Hard false-premise questions,Hard,Yes
Q61,"Since Google v Oracle was about ChatGPT training data, should we cite it as a direct LLM copyright case?",Hard false-premise questions,Hard,Yes
